{
  "approved": false,
  "calibration_validated": false,
  "model": "jev-1.13.0",
  "policy_version": "synthetic-example-not-approved",
  "questions_hash": "072951ae04cd5c283fcb70bd09875b2225b1c5ffcdfcbd09175f7f457cd8afc6",
  "thresholds_hash": "36c41f0ebe4b74b73783d0275a4ae43f2927bf12c14d9988040c59e1b08177dc",
  "holdout_evidence_ref": "SYNTHETIC SHAPE EXAMPLE; replace through independent evidence review",
  "activation_id": "synthetic-template-not-an-approval",
  "issued_at": "2026-09-26T00:00:00+00:00",
  "expires_at": "2026-09-26T00:01:00+00:00",
  "evidence_type": "synthetic",
  "revoked": true,
  "runtime_contract_hash": "319cb6ce90ff07f1cb959adf8be15fa5bf7783196b4d881174a7f7b300bce618",
  "ordered_questions_hash": "dd9547e0c94664ddc78d08a26cd63781c84f49b30a28e52ea7f80400d24a6c9d",
  "deployment_id": "synthetic-example",
  "study_digest": "95f14a3613b9305f4975ccfb61b026daf535270754ea6a812bc5766a6a74ad24"
}
